{
  "$id": "https://example.org/schema/business_case.schema.json",
  "$schema": "https://json-schema.org/draft/2020-12/schema",
  "title": "Public Sector Business Case (Five Case Model)",
  "type": "object",
  "required": [
    "metadata",
    "case_level",
    "strategic_case",
    "economic_case",
    "commercial_case",
    "financial_case",
    "management_case"
  ],
  "properties": {
    "metadata": {
      "type": "object",
      "required": [
        "title",
        "sro",
        "sponsoring_org",
        "date",
        "version"
      ],
      "properties": {
        "title": {
          "type": "string",
          "minLength": 5
        },
        "sro": {
          "type": "string"
        },
        "sponsoring_org": {
          "type": "string"
        },
        "date": {
          "type": "string",
          "format": "date"
        },
        "version": {
          "type": "string",
          "pattern": "^v\\d+\\.\\d+(\\.\\d+)?$"
        }
      }
    },
    "case_level": {
      "type": "string",
      "enum": [
        "BJC",
        "OBC",
        "FBC"
      ]
    },
    "strategic_case": {
      "type": "object",
      "required": [
        "problem_statement",
        "objectives",
        "strategic_fit",
        "stakeholders"
      ],
      "properties": {
        "problem_statement": {
          "type": "string"
        },
        "objectives": {
          "type": "array",
          "items": {
            "type": "string"
          },
          "minItems": 1
        },
        "strategic_fit": {
          "type": "string"
        },
        "stakeholders": {
          "type": "array",
          "items": {
            "type": "string"
          }
        }
      }
    },
    "economic_case": {
      "type": "object",
      "required": [
        "options",
        "preferred_option",
        "npv",
        "sensitivity"
      ],
      "properties": {
        "options": {
          "type": "array",
          "minItems": 2,
          "items": {
            "type": "string"
          }
        },
        "preferred_option": {
          "type": "string"
        },
        "npv": {
          "type": "number"
        },
        "sensitivity": {
          "type": "string"
        }
      }
    },
    "commercial_case": {
      "type": "object",
      "required": [
        "delivery_model",
        "route_to_market"
      ],
      "properties": {
        "delivery_model": {
          "type": "string",
          "enum": [
            "in-house",
            "outsourced",
            "hybrid",
            "AIaaS"
          ]
        },
        "route_to_market": {
          "type": "string"
        },
        "lock_in_mitigations": {
          "type": "string"
        },
        "data_ai_clauses": {
          "type": "string"
        }
      }
    },
    "financial_case": {
      "type": "object",
      "required": [
        "capex",
        "opex",
        "funding_profile",
        "cashable_benefits"
      ],
      "properties": {
        "capex": {
          "type": "number",
          "minimum": 0
        },
        "opex": {
          "type": "number",
          "minimum": 0
        },
        "funding_profile": {
          "type": "array",
          "items": {
            "type": "object",
            "required": [
              "year",
              "amount"
            ],
            "properties": {
              "year": {
                "type": "integer"
              },
              "amount": {
                "type": "number"
              }
            }
          }
        },
        "cashable_benefits": {
          "type": "number",
          "minimum": 0
        },
        "non_cashable_benefits": {
          "type": "string"
        }
      }
    },
    "management_case": {
      "type": "object",
      "required": [
        "plan",
        "governance",
        "assurance",
        "measurement"
      ],
      "properties": {
        "plan": {
          "type": "string"
        },
        "governance": {
          "type": "string"
        },
        "assurance": {
          "type": "array",
          "items": {
            "type": "string",
            "enum": [
              "Gate 0",
              "Gate 1",
              "Gate 2",
              "Gate 3",
              "Gate 4",
              "Gate 5"
            ]
          }
        },
        "measurement": {
          "type": "string"
        },
        "dpia_ref": {
          "type": "string"
        },
        "eqia_ref": {
          "type": "string"
        },
        "technical_feasibility": {
          "type": "string"
        }
      }
    }
  },
  "allOf": [
    {
      "if": {
        "properties": {
          "commercial_case": {
            "properties": {
              "delivery_model": {
                "const": "AIaaS"
              }
            }
          }
        }
      },
      "then": {
        "properties": {
          "commercial_case": {
            "required": [
              "data_ai_clauses",
              "lock_in_mitigations"
            ]
          }
        }
      }
    }
  ]
}